Date,Question,AcceptableAnswers,Difficulty,Fact
2026-04-18,"Who holds the UFC record for most wins with 27?",Jim Miller,Easy,"Jim Miller holds the UFC record with 27 wins inside the Octagon, making him the winningest fighter in UFC history. The durable lightweight has competed for well over a decade against the best in the division."
2026-04-18,Who did Brock Lesnar exact revenge against at UFC 100?,Frank Mir,Easy,Lesnar dominated and stopped Mir by TKO at UFC 100 avenging his submission loss from UFC 81 in front of one of the largest UFC crowds ever assembled.
2026-04-18,Who did Ronda Rousey fight in her UFC debut at UFC 157?,Liz Carmouche,Medium,Rousey submitted Carmouche with an armbar in the first round at UFC 157 to win the inaugural UFC women's bantamweight title in her promotional debut.
2026-04-18,Who did Lyoto Machida defeat at UFC 98 to become champion?,Rashad Evans,Medium,Machida knocked out Evans in the second round at UFC 98 with his signature karate style to claim the light heavyweight title and extend his unbeaten record.
2026-04-18,"Who is the only fighter to have victories over Rafael dos Anjos, Tony Ferguson, and Carlos Condit?",Michael Chiesa,Hard,"Chiesa holds wins over all three elite lightweights: dos Anjos by submission at UFC Fight Night 174 (2020), Ferguson by unanimous decision at UFC 262 (2021), and Condit by unanimous decision at UFC 232 (2018), making him the only fighter to have beaten all three."
2026-04-29,Who handed Jon Jones his only UFC loss by disqualification?,Matt Hamill,Easy,Jones was disqualified for repeatedly landing illegal downward elbows giving Hamill the technical victory. It remains the only loss on Jones UFC record and occurred before he ever won the championship.
2026-04-29,Which fighter is nicknamed The Spider?,Anderson Silva,Easy,Silva held the UFC middleweight title for over 2400 days making him one of the greatest champions in UFC history.
2026-04-29,"After knocking out Yoshihiro Akiyama at UFC 133 and submitting Anthony Johnson at UFC 142, who challenged Jon Jones for the Light Heavyweight title at UFC 152?",Vitor Belfort,Medium,"Belfort arrived at UFC 152 on momentum, having finished both Akiyama and Johnson impressively. Jones submitted him with a keylock (Americana) in the fourth round to retain his title in a fight Jones himself later called his most challenging to that point."
2026-04-29,Who did Demetrious Johnson defeat to win the inaugural UFC flyweight championship?,Joseph Benavidez,Medium,Johnson defeated Benavidez by split decision at UFC on Fox 2 in January 2012 to become the first flyweight champion.
2026-04-29,"Who is the only fighter to hold wins over Rafael Dos Anjos, Renan Barao, and Gilbert Melendez?",Jeremy Stephens,Hard,"Stephens holds victories over former UFC lightweight champion dos Anjos, former UFC bantamweight champion Barao, and former Strikeforce lightweight champion Melendez — three former champions across multiple divisions. Despite this elite resume, Stephens never captured a UFC title himself."
2026-05-02,Which fighter is known by the nickname Stylebender?,Israel Adesanya,Easy,Adesanya is a former kickboxing champion from New Zealand who brought his striking artistry to the UFC middleweight division.
2026-05-02,Who did Holly Holm knock out to win the UFC women's bantamweight title at UFC 193?,Ronda Rousey,Easy,Holm landed a head kick in the second round to shock the world and end Rousey's dominant title reign in front of over 56000 fans in Melbourne.
2026-05-02,Who did Ronda Rousey defeat in 14 seconds at UFC 184 to record the fastest finish of her UFC career?,Cat Zingano,Medium,Rousey submitted Zingano with an armbar just 14 seconds into their fight at UFC 184 the fastest finish in UFC women's bantamweight history and the quickest win of Rousey's legendary title reign.
2026-05-02,Who holds the record for the fastest knockout in UFC history?,Jorge Masvidal,Medium,Masvidal knocked out Ben Askren in just 5 seconds at UFC 239 with a flying knee setting the all-time UFC record.
2026-05-02,Who did Cris Cyborg defeat to win the inaugural UFC women's featherweight title?,Tonya Evinger,Hard,Cyborg demolished Evinger in the third round at UFC 214 to claim the first ever UFC women's featherweight championship.
2026-05-04,Who won the very first UFC tournament at UFC 1 in 1993?,Royce Gracie,Easy,Gracie submitted all three opponents in one night to win UFC 1 introducing Brazilian jiu-jitsu to the world and forever changing combat sports.
2026-05-04,Which fighter is nicknamed The Notorious?,Conor McGregor,Easy,McGregor earned his nickname during his rise through the Irish MMA scene before becoming a two-division UFC champion.
2026-05-04,Who did Amanda Nunes defeat to win her first UFC bantamweight title?,Miesha Tate,Medium,Nunes stopped Tate in the first round at UFC 200 to begin one of the most dominant championship reigns in UFC history.
2026-05-04,Who did Khabib Nurmagomedov defeat to win the vacant UFC lightweight championship?,Al Iaquinta,Medium,"Khabib defeated Iaquinta by unanimous decision at UFC 223 in April 2018 to win the vacant lightweight title. Iaquinta stepped in on short notice after multiple opponents fell out, and pushed Khabib for five rounds despite being a significant underdog."
2026-05-04,"What fighter was knocked out in 7 seconds at UFC 149 by Ryan Jimmo, and in the very next fight won by knockout in 14 seconds over Vinny Magalhaes at UFC 163?",Anthony Perosh,Hard,Perosh holds the unique distinction of suffering one of the fastest knockouts in UFC history (7 seconds vs Jimmo at UFC 149) and then responding with one of the fastest knockouts of his own (14 seconds vs Magalhaes at UFC 163). The back-to-back quick finishes made him one of the most memorable light heavyweights of that era.
2026-05-06,Who did Robert Whittaker defeat by split decision in a rematch at UFC 225?,Yoel Romero,Easy,Whittaker edged Romero in a close split decision at UFC 225 in Chicago. Their first fight at UFC 213 had also been controversial with many scoring it for Romero.
2026-05-06,Which fighter is nicknamed Blessed?,Max Holloway,Easy,Holloway is widely regarded as one of the greatest featherweights in UFC history with the most significant strikes landed in divisional history.
2026-05-06,Who did Max Holloway defeat to win the interim UFC featherweight championship?,Anthony Pettis,Medium,Holloway defeated Pettis by TKO at UFC Fight Night 103 in December 2016 to win the interim featherweight title. He then unified it against Jose Aldo at UFC 212 in June 2017 to become undisputed champion.
2026-05-06,Who did Tony Ferguson defeat to win the interim UFC lightweight championship?,Kevin Lee,Medium,Ferguson submitted Lee with a triangle choke in the third round at UFC 216 to claim the interim lightweight title.
2026-05-06,Who did Carlos Condit defeat to win the interim UFC welterweight championship?,Nick Diaz,Hard,Condit defeated Diaz by unanimous decision at UFC 143 in a fight many felt Diaz had won earning him a shot at GSP.
2026-05-09,Who did Conor McGregor defeat by majority decision at UFC 202 in their welterweight rematch?,Nate Diaz,Easy,McGregor won the UFC 202 rematch against Diaz by majority decision in a five-round war. Diaz had submitted McGregor at UFC 196 in one of the biggest upsets in UFC history. Both earned Fight of the Night bonuses.
2026-05-09,Which fighter is nicknamed The Eagle?,Khabib Nurmagomedov,Easy,Khabib retired undefeated at 29-0 after submitting Justin Gaethje at UFC 254 and dedicated the win to his late father.
2026-05-09,Who did Tito Ortiz defeat at UFC 25 to win the vacant UFC light heavyweight title?,Wanderlei Silva,Medium,Ortiz defeated Silva by unanimous decision at UFC 25 in May 2000 to win the vacant UFC light heavyweight title. The title was vacant after Frank Shamrock vacated it. Silva was 13-3 at the time entering the fight.
2026-05-09,"At 43 years old, who knocked off Tim Sylvia to win the UFC Heavyweight Championship at UFC 68?",Randy Couture,Medium,"Couture came out of retirement at 43 to upset the heavily favored Sylvia at UFC 68 in Columbus, Ohio in March 2007. He dominated the much younger champion for five rounds, winning a unanimous decision to claim the heavyweight title for a third time."
2026-05-09,"What fighter had this four-fight winning streak: Split Decision over John Dodson, KO over Aljamain Sterling, KO over Jimmie Rivera, and Submission over Raphael Assuncao?",Marlon Moraes,Hard,"Moraes went on a dominant run through the bantamweight division, defeating Sterling, Rivera, and Assuncao in succession to earn a UFC bantamweight title shot against Henry Cejudo at UFC 238, where he was stopped in round 3."
2026-05-11,Who did Khabib Nurmagomedov submit with a triangle choke in round 2 to defend his UFC lightweight title for the final time at UFC 254?,Justin Gaethje,Easy,"Khabib submitted interim champion Gaethje in round 2 at UFC 254, then announced his retirement in the Octagon. He finished 29-0, never losing a round in his final three fights."
2026-05-11,Which fighter is nicknamed DC?,Daniel Cormier,Easy,Cormier is a former Olympic wrestler who became a two-division UFC champion holding titles at both light heavyweight and heavyweight.
2026-05-11,"Debuting at TUF: Heavyweights Finale, who did Kimbo Slice defeat for his lone UFC victory by decision?",Houston Alexander,Medium,"Kimbo Slice, the internet fighting sensation, made his only UFC win by defeating Alexander at The Ultimate Fighter: Heavyweights Finale in December 2009 via unanimous decision. It was his lone UFC victory before his contract ended."
2026-05-11,Who did Joanna Jedrzejczyk defeat to win her first UFC strawweight title?,Carla Esparza,Medium,Jedrzejczyk knocked out Esparza in the second round at UFC 185 to begin a dominant strawweight title reign.
2026-05-11,"What fighter had this four-fight winning streak: KO over Scott Holtzman, Submission over Jeremy Stephens, TKO over Carlos Diego Ferreira, and Unanimous Decision over Arman Tsarukyan?",Mateusz Gamrot,Hard,"Gamrot went on this impressive run through the lightweight division to establish himself as one of the top contenders. His wins over Stephens, Ferreira, and Tsarukyan in particular showcased his elite grappling and well-rounded skillset."
2026-05-13,Who did Miesha Tate defeat to win the UFC women's bantamweight title?,Holly Holm,Easy,Tate submitted Holm with a rear naked choke in the fifth round at UFC 196 in one of the most dramatic finishes in UFC history.
2026-05-13,Which fighter is nicknamed The Korean Zombie?,Chan Sung Jung,Easy,Jung earned his nickname for his relentless pressure and durability and is one of South Korea's most celebrated MMA fighters.
2026-05-13,Who did BJ Penn submit to win the UFC welterweight title at UFC 46?,Matt Hughes,Medium,Penn caught Hughes in a triangle armbar at UFC 46 to win the welterweight title becoming the first fighter to hold titles in two weight classes.
2026-05-13,Who did Jose Aldo defeat in his first UFC featherweight title defense after the WEC merger?,Mark Hominick,Medium,Aldo defeated Hominick by unanimous decision at UFC 129 in front of over 55000 fans in Montreal in one of the most attended UFC events ever held at the time.
2026-05-13,Who did Rose Namajunas defeat by split decision in a non-title strawweight rematch at UFC 251?,Jessica Andrade,Hard,Namajunas defeated Andrade by split decision at UFC 251 in July 2020 on Fight Island in a non-title fight — Weili Zhang held the title at the time. Rose used her jiu-jitsu and movement to edge out the decision over the powerful Andrade.
2026-05-16,Who did Anderson Silva knock out with a front kick at UFC 126 to make one of the most memorable finishes of his title reign?,Vitor Belfort,Easy,Silva landed a perfectly timed front kick to the chin of Belfort at UFC 126 in one of the most technically brilliant finishes in UFC history during his legendary middleweight title reign.
2026-05-16,Which fighter is nicknamed The Huntington Beach Bad Boy?,Tito Ortiz,Easy,Ortiz was one of the most popular and controversial fighters of the early UFC era and held the light heavyweight title for three years.
2026-05-16,Who did Holly Holm knock out with a head kick in the third round at UFC Fight Night 111 in Singapore?,Bethe Correia,Medium,"Holm knocked out Correia with a head kick at 1:09 of round 3 at UFC Fight Night 111 in June 2017 in Singapore. This was Holm's first fight after losing the bantamweight title to Miesha Tate, and she was not the champion at the time of this bout."
2026-05-16,Who is the only fighter to defeat Chad Mendes twice in the UFC?,Jose Aldo,Medium,Aldo defeated Mendes twice — first at WEC 48 in 2010 and then in a rematch at UFC 142 in January 2012 — making him the only fighter to beat Mendes twice. Mendes later earned two title shots against Aldo for the featherweight crown.
2026-05-16,"Ineligible to win the interim Middleweight title due to missing weight, who did Yoel Romero knock out at UFC 221?",Luke Rockhold,Hard,"Romero missed weight and was ineligible to win the interim middleweight title at UFC 221, but he stopped Rockhold with a brutal knockout in round 3 in February 2018. Had Romero made weight, he would have been crowned interim champion."
2026-05-18,Who did Israel Adesanya knock out in the second round to unify the UFC middleweight title at UFC 243?,Robert Whittaker,Easy,Adesanya finished Whittaker in the second round at UFC 243 in Melbourne in front of over 57000 fans in one of the most anticipated middleweight title fights in years.
2026-05-18,Who did Jon Jones defeat to win his first UFC light heavyweight title at UFC 128?,Mauricio Rua,Easy,Jones stopped Rua by TKO in the third round becoming the youngest UFC champion in history at just 23 years old.
2026-05-18,Who did Chuck Liddell knock out at UFC 66 to make his fourth UFC light heavyweight title defense?,Tito Ortiz,Medium,"Liddell knocked out Ortiz in round 3 at UFC 66 in December 2006 in their rematch, making his fourth consecutive light heavyweight title defense. The event drew over 1 million PPV buys, the first UFC event to reach that milestone."
2026-05-18,Who did Rose Namajunas defeat to win her first UFC strawweight title?,Joanna Jedrzejczyk,Medium,Namajunas knocked out Jedrzejczyk in the first round at UFC 217 in one of the most shocking upsets in women's MMA history.
2026-05-18,"Aside from BJ Penn and Georges St-Pierre, who is the only fighter to defeat Matt Hughes twice?",Dennis Hallman,Hard,"Hallman defeated Hughes twice in regional competition early in their careers, making him the only fighter outside of Penn and GSP to beat Hughes twice. The losses were both early in Hughes' career before he became the dominant UFC welterweight champion."
2026-05-20,Who did Jon Jones put to sleep with a standing guillotine choke in the second round at UFC 140 to make his second light heavyweight title defense?,Lyoto Machida,Easy,"Jones dominated Machida in round 2 at UFC 140 in Toronto, catching his attempted takedown and locking in a tight standing guillotine that put Machida unconscious with 34 seconds left in the round. It is considered one of the most spectacular finishes in light heavyweight history."
2026-05-20,Which fighter is nicknamed The Lionheart?,Anthony Smith,Easy,Smith earned his reputation as one of the most durable and determined fighters in the light heavyweight division.
2026-05-20,Who did Jon Jones submit in the fourth round to make his first UFC light heavyweight title defense at UFC 135?,Quinton Jackson,Medium,"Jones dominated Rampage for four rounds at UFC 135 in Denver, using his reach and wrestling before locking in a rear naked choke in round 4. Jackson attempted to roll out but Jones stayed with him until the tap."
2026-05-20,Who did Tyron Woodley defeat to win the UFC welterweight championship?,Robbie Lawler,Medium,Woodley knocked out Lawler in the first round at UFC 201 to win the welterweight title in stunning fashion.
2026-05-20,"Defeating Brendan Allen for the inaugural LFA Middleweight title, what undefeated fighter defeated Rafael Natal by first-round knockout at UFC on Fox: Weidman vs. Gastelum?",Eryk Anders,Hard,"Anders had won the inaugural LFA Middleweight Championship before making his UFC debut, where he knocked out veteran Natal in round 1 at UFC on Fox: Weidman vs. Gastelum in July 2017. He went on to compile a solid UFC record at middleweight and light heavyweight."
2026-05-23,Who holds the record for most wins by knockout in UFC history?,Derrick Lewis,Easy,Lewis surpassed the record previously held by Chuck Liddell to become the UFC's all-time leader in knockout victories earning him the nickname The Black Beast.
2026-05-23,Which fighter is nicknamed The Nigerian Nightmare?,Kamaru Usman,Easy,Usman made the most welterweight title defenses in UFC history surpassing the record set by Georges St-Pierre.
2026-05-23,Who did Kamaru Usman defeat to win his first UFC welterweight title?,Tyron Woodley,Medium,Usman dominated Woodley over five rounds at UFC 235 to win the welterweight championship and begin a historic title reign.
2026-05-23,Who knocked out Mirko Cro Cop with a head kick at UFC 70 earning a heavyweight title shot?,Gabriel Gonzaga,Medium,Gonzaga knocked out the feared Cro Cop with his own signature weapon — a head kick — at UFC 70 in one of the biggest upsets in heavyweight history earning a shot at Randy Couture's title.
2026-05-23,Who is the only fighter to defeat Fedor Emelianenko twice?,Ryan Bader,Hard,"Bader defeated Fedor twice in Bellator — first by KO in round 1 at Bellator 214 in January 2019 to win the Bellator Heavyweight Championship, and again in their rematch. He is the only fighter to have beaten Fedor more than once across his legendary career."
2026-05-25,Who did GSP defeat to win his first UFC welterweight title at UFC 65?,Matt Hughes,Easy,GSP defeated the dominant champion Hughes at UFC 65 avenging his previous loss and beginning one of the greatest welterweight title reigns in UFC history.
2026-05-25,Which fighter is nicknamed The Prodigy?,B.J. Penn,Easy,Penn was one of the most naturally gifted fighters in UFC history winning titles at both lightweight and welterweight.
2026-05-25,Who did TJ Dillashaw defeat to win the UFC bantamweight title in a major upset at UFC 173?,Renan Barao,Medium,Dillashaw stopped the previously unbeaten Barao in the fifth round in one of the biggest upsets in bantamweight history showcasing footwork and timing that baffled the champion.
2026-05-25,Who did Luke Rockhold defeat to win his first UFC middleweight title?,Chris Weidman,Medium,Rockhold knocked out Weidman in the fourth round at UFC 194 to win the middleweight championship in impressive fashion.
2026-05-25,Who did Khabib Nurmagomedov submit in the third round to win his UFC debut at UFC on FX 1?,Kamal Shalorus,Hard,"Khabib submitted Shalorus with a rear naked choke in round 3 at UFC on FX 1 in January 2012, beginning his unbeaten UFC run. He went on to go 13-0 in the UFC before retiring as lightweight champion."
2026-05-27,Who was the first UFC fighter to hold world titles in two weight classes simultaneously?,Conor McGregor,Easy,"McGregor became the first simultaneous two-division UFC champion when he defeated Eddie Alvarez for the lightweight title at UFC 205 while holding the featherweight title. He held both belts at the same time, a first in UFC history."
2026-05-27,Which fighter is nicknamed Killa B?,Ben Saunders,Easy,Ben Saunders earned the nickname Killa B during his UFC career as a welterweight and middleweight known for his dynamic striking and submission skills. He competed in the UFC across two stints and was known for his exciting fighting style.
2026-05-27,Who did Francis Ngannou knock out in the first round at UFC 218 to earn his heavyweight title shot?,Alistair Overeem,Medium,Ngannou demolished Overeem with a left uppercut in round 1 at UFC 218 in December 2017 in Detroit. The ferocious finish earned him an immediate title shot against Stipe Miocic and announced him as the most dangerous puncher in heavyweight history.
2026-05-27,Who did Glover Teixeira defeat to win the UFC light heavyweight championship at UFC 267?,Jan Blachowicz,Medium,"Teixeira won the light heavyweight title at age 41 at UFC 267, submitting Blachowicz in round 5 in Abu Dhabi. He later lost the title to Jiri Prochazka via a rear naked choke submission in the final seconds of their UFC 275 fight."
2026-05-27,"What fighter had this four-fight winning streak: TKO over Karl Roberson, Split Decision over Dustin Jacoby, TKO over Chris Daukaus, and TKO over Anthony Smith?",Khalil Rountree Jr.,Hard,Rountree went on this winning streak through the light heavyweight division to earn a UFC light heavyweight title shot. His four consecutive finishes showcased his power and finishing ability as one of the most dangerous strikers at 205 pounds.
2026-05-30,Who did Cain Velasquez defeat by TKO to win his first UFC heavyweight title at UFC 121?,Brock Lesnar,Easy,"Velasquez dominated Lesnar with relentless striking and takedowns, stopping him in the first round at UFC 121 in October 2010. It was Cain's first heavyweight title win, ending Lesnar's title reign."
2026-05-30,Which fighter is nicknamed Bones?,Jon Jones,Easy,Jones earned the nickname Bones due to his lanky physique with long limbs that give him a significant reach advantage.
2026-05-30,Who did Dominick Cruz defeat by unanimous decision at UFC on Versus 6 to make his second UFC bantamweight title defense?,Demetrious Johnson,Medium,"Cruz defeated Johnson by unanimous decision at UFC on Versus 6 in October 2011, his second UFC bantamweight title defense. Cruz had already become champion by defeating Urijah Faber at UFC 132 in his first defense."
2026-05-30,Who did Jon Jones defeat in his sixth light heavyweight title defense at UFC 165 to break the divisional record?,Alexander Gustafsson,Medium,Jones defeated Gustafsson by unanimous decision at UFC 165 in his sixth title defense breaking Tito Ortiz's record for most consecutive light heavyweight title defenses. Many observers felt Gustafsson had won the fight.
2026-05-30,Who is the only fighter to hold wins over Luke Rockhold and Israel Adesanya?,Jan Blachowicz,Hard,"Blachowicz holds victories over former UFC middleweight champions Rockhold and Adesanya. He submitted Rockhold at UFC Fight Night 141 and defeated Adesanya at UFC 259 in his first light heavyweight title defense, making him the only fighter to have beaten both men."
2026-06-01,Who did Robbie Lawler defeat to win his first UFC welterweight title?,Johny Hendricks,Easy,Lawler defeated Hendricks by split decision in their rematch at UFC 181 to win the welterweight championship.
2026-06-01,Which fighter is nicknamed Gamebred?,Jorge Masvidal,Easy,Masvidal earned his nickname from his street fighting background in Miami where he competed in backyard fights as a teenager.
2026-06-01,Who did Zhang Weili knock out in 42 seconds to win the UFC strawweight title at UFC Fight Night 157?,Jessica Andrade,Medium,"Zhang knocked out the champion Andrade with a barrage of punches in just 42 seconds at UFC Fight Night 157 in Shenzhen, China in August 2019, becoming the first Chinese UFC champion. The finish was one of the most shocking title changes in strawweight history."
2026-06-01,Who did Cody Garbrandt defeat by unanimous decision to win the UFC bantamweight title at UFC 207?,Dominick Cruz,Medium,"Garbrandt defeated the seemingly invincible Cruz at UFC 207 in December 2016, knocking him down multiple times with crisp boxing. The win ended Cruz's 1000-day title reign."
2026-06-01,"What fighter had this four-fight winning streak: KO over Jon Fitch, Split Decision over Josh Koscheck, KO over Martin Kampmann, and Unanimous Decision over Carlos Condit?",Johny Hendricks,Hard,"Hendricks went on a remarkable run through the welterweight division's best, defeating Fitch, Koscheck, Kampmann, and Condit in succession to earn a UFC welterweight title shot against Georges St-Pierre at UFC 167, where he arguably won the fight but lost a controversial split decision."
2026-06-03,Which fighter is nicknamed The Last Stylebender?,Israel Adesanya,Easy,Adesanya took the Stylebender nickname from the anime Avatar The Last Airbender as a nod to his fluid striking style.
2026-06-03,Who did Stipe Miocic defeat by TKO in the first round to win his first heavyweight title at UFC 198?,Fabricio Werdum,Easy,Miocic stormed Werdum in the first round at UFC 198 in Brazil stopping the champion with ground and pound to begin his historic run as the most decorated heavyweight champion in UFC history.
2026-06-03,Who did TJ Dillashaw defeat to win back the UFC bantamweight title at UFC 217?,Cody Garbrandt,Medium,Dillashaw knocked out Garbrandt in the third round of their rematch at UFC 217 to reclaim the bantamweight title he had previously vacated.
2026-06-03,Who was the first fighter to knock out Anderson Silva in the UFC?,Chris Weidman,Medium,Weidman knocked out Silva in the second round at UFC 162 ending Silva's historic 2457 day title reign in one of the biggest upsets in UFC history.
2026-06-03,"What fighter knocked out Charles Oliveira at UFC 152, then followed it up with a decision victory over Dustin Poirier at UFC on Fuel TV 7?",Cub Swanson,Hard,Swanson stopped Oliveira by TKO at UFC 152 in September 2012 and then defeated Poirier by unanimous decision at UFC on Fuel TV 7 in February 2013. The back-to-back wins over two future champions announced Swanson as a legitimate featherweight contender.
2026-06-06,Which fighter is nicknamed Showtime?,Anthony Pettis,Easy,Pettis earned fame for his acrobatic fighting style including the famous wall-walk kick against Benson Henderson.
