Date,Question,AcceptableAnswers,Difficulty,Fact
2026-07-11,Who did Cain Velasquez defeat by TKO at UFC 160 in his first title defense of his second reign?,Antonio Silva,Medium,"Velasquez won his second title reign at UFC 155, then made his first defense of that second reign at UFC 160 in May 2013, stopping Big Foot Silva with strikes in round 5. It was Cain's first title defense of his second championship run after reclaiming the belt from Junior dos Santos."
2026-07-11,Who did Junior dos Santos KO in the first round to win the UFC heavyweight title at UFC on Fox 1?,Cain Velasquez,Hard,Dos Santos landed a right hand that put Velasquez down at UFC on Fox 1 in just 64 seconds to win the heavyweight title in one of the most shocking upsets in division history.
2026-07-13,Who did Anderson Silva defeat to win his first UFC middleweight title?,Rich Franklin,Easy,Silva knocked out Franklin with devastating knees in the clinch at UFC 64 to begin his legendary championship reign.
2026-07-13,Who did Carla Esparza defeat to win the UFC strawweight title for the second time at UFC 274?,Rose Namajunas,Easy,Esparza defeated Namajunas by unanimous decision at UFC 274 using her wrestling to neutralize Namajunas's striking and win back the title she had originally won on TUF 20.
2026-07-13,Who did BJ Penn submit in the second round with a rear naked choke to win the vacant UFC lightweight title at UFC 80?,Joe Stevenson,Medium,"Penn defeated Stevenson at UFC 80 in January 2008, winning the vacant lightweight title. Penn dominated the fight with crisp striking and relentless ground-and-pound before finishing with an RNC."
2026-07-13,Who did Cheick Kongo score an insane comeback knockout victory over at UFC on Versus 4?,Pat Barry,Medium,Barry had Kongo nearly finished multiple times and looked moments away from stopping the fight when Kongo landed a wild right hand that floored Barry. Kongo finished with ground strikes in one of the most remarkable heavyweight comeback knockouts in UFC history at UFC on Versus 4 in June 2011.
2026-07-13,Who is the only fighter to hold victories over both Randy Couture and Alistair Overeem?,Chuck Liddell,Hard,"Liddell knocked out Overeem in the Pride 2003 middleweight Grand Prix quarterfinals, and also defeated Couture twice in their title trilogy at UFC 52 and UFC 57. No other fighter holds wins over both men, making Liddell uniquely positioned across both promotions' heavyweight legends."
2026-07-15,Who is the only fighter to hold wins over both Phil Baroni and Chris Weidman?,Brad Tavares,Easy,"Tavares defeated Baroni by TKO in the first round in 2011 and scored an upset split decision over former UFC middleweight champion Weidman in 2018, making him the only fighter to have wins over both men. Tavares has been a durable and consistent UFC middleweight throughout his career."
2026-07-15,Which fighter is nicknamed Rampage?,Quinton Jackson,Easy,Jackson earned his Rampage nickname for his explosive fighting style including his signature slam finishes popularized in Pride FC.
2026-07-15,Who did Quinton Jackson defeat by unanimous decision at UFC 75 to unify the UFC light heavyweight title?,Dan Henderson,Medium,"Jackson defeated Pride middleweight champion Henderson by unanimous decision at UFC 75 in London in September 2007, unifying the UFC and Pride light heavyweight titles. Henderson had entered as the underdog but gave Jackson a tough five rounds."
2026-07-15,What former UFC lightweight champion ended his career with seven consecutive losses?,BJ Penn,Medium,"Penn returned to fight numerous times after his prime, losing his final seven UFC bouts in a row. Despite ending his career with a long losing streak, Penn is considered one of the greatest lightweights in UFC history, having been the first simultaneous two-division UFC champion."
2026-07-15,"What fighter had this four-fight winning streak: Unanimous Decision over Mike Perry, TKO over Preston Parsons, Unanimous Decision over Kevin Lee, and Split Decision over Li Jingliang?",Daniel Rodriguez,Hard,"Rodriguez went on this impressive welterweight run to establish himself as a top contender in the division. His wins over Perry and Lee in particular showcased his striking and toughness, making him one of the more exciting welterweights during his UFC tenure."
2026-07-18,Who did Justin Gaethje stop by TKO in the fifth round to win the interim UFC lightweight title at UFC 249?,Tony Ferguson,Easy,"Gaethje finished Ferguson with a barrage of leg kicks and punches in round 5 at UFC 249 in May 2020, winning the interim lightweight title. Ferguson had been on a 12-fight winning streak entering the fight. Gaethje's calculated leg kick assault was widely praised as a masterclass in fight strategy."
2026-07-18,Who did Dan Henderson famously knock out at UFC 100?,Michael Bisping,Easy,"Henderson knocked Bisping unconscious with a massive overhand right in round 2 at UFC 100 in July 2009, then controversially jumped on the downed fighter for an extra shot. The highlight-reel knockout is one of the most celebrated in UFC history."
2026-07-18,Who did Islam Makhachev knock out to make his second UFC lightweight title defense at UFC 294?,Alexander Volkanovski,Medium,"Makhachev knocked out Volkanovski in round 1 at UFC 294 in Abu Dhabi in October 2023, finishing their rematch by KO after Volkanovski had put on a closer performance in their UFC 284 fight. Volkanovski had again taken the fight on short notice."
2026-07-18,Who did Khabib Nurmagomedov dominate by unanimous decision at UFC 219 to earn his UFC lightweight title shot?,Edson Barboza,Medium,"Khabib dominated Barboza completely at UFC 219 in December 2017, scoring 30-25 on all three judges' cards. The performance, which saw Khabib control Barboza on the mat for nearly all 15 minutes, earned him the Performance of the Night bonus and finally secured him a title shot."
2026-07-18,"Who is the only fighter to hold wins over Fabricio Werdum, Mirko Cro Cop, and Travis Browne?",Alexei Oleinik,Hard,"Oleinik holds victories over former UFC heavyweight champion Werdum, Pride legend Cro Cop, and Travis Browne across his long career. The Russian submission specialist is one of the most durable and experienced heavyweights in MMA history with over 70 professional fights."
2026-07-20,Who did Kevin Lee defeat at UFC Fight Night 112 to earn an interim lightweight title fight?,Michael Chiesa,Easy,"Lee submitted Chiesa with a rear naked choke in round 5 at UFC Fight Night 112 in June 2017, earning an interim lightweight title fight against Tony Ferguson. The win was controversial as Lee missed weight, but the result stood and he went on to fight Ferguson."
2026-07-20,Who did Alexander Volkanovski defeat by unanimous decision at UFC 276 to make his fourth featherweight title defense?,Max Holloway,Easy,"Volkanovski edged Holloway in their trilogy fight at UFC 276 in July 2022, winning a unanimous decision to retain his featherweight title for the fourth time. The trilogy solidified Volkanovski's status as an all-time great featherweight."
2026-07-20,Who did Conor McGregor knock out in the first round at UFC on Fuel TV 9 to make his highly anticipated UFC debut?,Marcus Brimage,Medium,"McGregor knocked out Brimage with a flurry of strikes at 1:07 of the first round at UFC on Fuel TV 9 in April 2013, earning Knockout of the Night in his promotional debut. He had previously held both the Cage Warriors featherweight and lightweight titles."
2026-07-20,Who did Dominick Cruz defeat by unanimous decision at UFC 199 in their trilogy fight to make his final bantamweight title defense?,Urijah Faber,Medium,"Cruz completed the trilogy against his longtime rival Faber at UFC 199, winning by unanimous decision to retain his title. It was Faber's last shot at the bantamweight title after three failed attempts against Cruz."
2026-07-20,"What fighter had this four-fight winning streak: Split Decision over Aljamain Sterling, Split Decision over Marlon Moraes, KO over Matthew Lopez, and Unanimous Decision over Rob Font?",Cory Sandhagen,Hard,"Sandhagen went on this impressive bantamweight run, defeating three fighters who all went on to championship contention — Sterling (future champion), Moraes (former title challenger), and Font — to establish himself as the top contender in the division."
2026-07-22,Which fighter is nicknamed Big Nog?,Antonio Rodrigo Nogueira,Easy,Nogueira is a Brazilian legend famous for his world-class Brazilian jiu-jitsu and his incredible ability to survive punishment and submit opponents.
2026-07-22,Who did Cain Velasquez defeat by TKO to win back the UFC heavyweight title and win the trilogy at UFC 166?,Junior dos Santos,Easy,"Velasquez stopped Junior dos Santos in round 5 at UFC 166 in October 2013 to win the trilogy and reclaim the heavyweight title. After losing his title to JDS at UFC on Fox 1, Cain won the rematch at UFC 155 and completed the trilogy at UFC 166."
2026-07-22,Who did Alistair Overeem defeat at UFC 141 in his UFC debut?,Brock Lesnar,Medium,"Overeem made his UFC debut at UFC 141 in December 2011, knocking out Lesnar in round 1 with a combination of body kicks and punches. The win over the former UFC heavyweight champion announced Overeem as a serious title contender immediately."
2026-07-22,Who did Valentina Shevchenko defeat by unanimous decision at UFC on Fox 23 to earn a UFC flyweight title shot?,Julianna Pena,Medium,"Shevchenko defeated Pena by unanimous decision at UFC on Fox 23 in January 2018, earning her flyweight title shot. She went on to dominate Joanna Jedrzejczyk at UFC 231 to win the inaugural flyweight championship."
2026-07-22,Who is the only fighter to hold wins over Rich Franklin and Frank Shamrock?,Cung Le,Hard,"Le defeated Frank Shamrock by TKO in round 3 at Strikeforce in March 2008 to win the Strikeforce Middleweight Championship, then knocked out Rich Franklin in the first round at UFC on Fuel TV 6 in November 2012. He is the only fighter to hold wins over both men."
2026-07-25,Who did Rashad Evans defeat by controversial split decision at UFC 78 to earn his UFC light heavyweight title shot?,Michael Bisping,Easy,"Evans edged Bisping 2-1 on the judges' scorecards at UFC 78 in a fight most felt was very close. Two judges gave it to Evans, one to Bisping. Evans went on to win the light heavyweight title at UFC 92 by knocking out Forrest Griffin."
2026-07-25,Who is the only fighter to defeat Lyoto Machida twice?,Phil Davis,Easy,"Davis defeated Machida twice: by split decision at UFC on Fox 4 in 2012, and again at Bellator 179 in 2017 by unanimous decision. He is the only fighter to have beaten Machida twice across their careers."
2026-07-25,Who did Demetrious Johnson defeat by unanimous decision at UFC on Fox 24 to tie Anderson Silva's record for consecutive UFC title defenses?,Wilson Reis,Medium,"Johnson defeated Reis by unanimous decision at UFC on Fox 24 in April 2017, making his tenth consecutive flyweight title defense to tie Anderson Silva's record. He broke it with a flying armbar finish of Ray Borg at UFC 216."
2026-07-25,"Who did Magomed Ankalaev defeat by TKO at UFC 277, ultimately earning a shot at the vacant light heavyweight title?",Anthony Smith,Medium,"Ankalaev stopped Smith by TKO in round 2 at UFC 277 in July 2022, earning the light heavyweight title shot. He fought Jiri Prochazka for the vacant title at UFC 282 and the fight ended in a split draw, with both men leaving without the belt."
2026-07-25,Who did Anderson Silva defeat at UFC 82 to make his third UFC middleweight title defense?,Dan Henderson,Hard,Silva submitted Henderson with a rear naked choke in the second round at UFC 82 in a title unification bout against the Pride FC welterweight champion. It was Henderson's first loss in the UFC.
2026-07-27,Who did Cris Cyborg defeat at UFC 198 in her UFC debut?,Leslie Smith,Easy,"Cyborg made her UFC debut at UFC 198 in Curitiba, Brazil in May 2016, stopping Smith via TKO in round 1. It was the first UFC women's featherweight bout and Cyborg was dominant, leading to her eventual inaugural UFC featherweight title win against Tonya Evinger."
2026-07-27,Who did Robbie Lawler defeat in a bloody five round war to make his first UFC welterweight title defense at UFC 195?,Carlos Condit,Easy,Lawler defeated Condit in a five round classic at UFC 195 in one of the most entertaining welterweight title fights in history with both men landing heavy shots throughout.
2026-07-27,Who did Kamaru Usman defeat via TKO to make his third UFC welterweight title defense?,Gilbert Burns,Medium,"Usman finished Burns via TKO in round 3 at UFC 258 in February 2021. Burns had landed some early offense and dropped Usman momentarily, but Usman recovered and dominated the remainder of the fight."
2026-07-27,Who did Paddy Pimblett defeat in his UFC debut at UFC Fight Night 193 after being knocked down early in the fight?,Luigi Vendramini,Medium,Pimblett was dropped early by Vendramini but came back to finish him by TKO in the first round at UFC Fight Night 193. The dramatic comeback made him an instant fan favourite in the UFC.
2026-07-27,Who is the only fighter to hold wins over both Iuri Alcantara and Renan Barao?,Brian Kelleher,Hard,Kelleher defeated both of the Brazilian bantamweight standouts during his UFC tenure — beating Alcantara and former longtime UFC interim bantamweight champion Barao — making him the only fighter to hold wins over both men.
2026-07-29,"A former Fight Night Global Heavyweight Champion, this future title contender lost his UFC debut to Alistair Overeem.",Sergei Pavlovich,Easy,"Pavlovich held the Fight Night Global Heavyweight Championship before joining the UFC, where he lost his debut to Overeem by TKO in round 1 at UFC Fight Night 130 in May 2018. He went on to win 9 straight UFC bouts, knocking out Tom Aspinall to become the interim heavyweight champion at UFC 295."
2026-07-29,Who did Quinton Jackson defeat to win the UFC light heavyweight title at UFC 71?,Chuck Liddell,Easy,Jackson knocked out Liddell with a massive right hand at UFC 71 to win the light heavyweight title avenging a previous stoppage loss and cementing himself as a UFC champion.
2026-07-29,Who did Matt Hughes defeat by TKO in the first round to make his first UFC welterweight title defense at UFC 63?,BJ Penn,Medium,"Hughes dominated Penn in their rematch at UFC 63 in September 2006, stopping him with ground-and-pound in round 1 in his first title defense of his second reign. It was a one-sided rematch after their first meeting at UFC 46 went to Penn."
2026-07-29,Who did Weili Zhang dominate by unanimous decision at UFC 312 to make her third consecutive strawweight title defense?,Tatiana Suarez,Medium,"Zhang dominated the previously unbeaten Suarez at UFC 312 in Sydney, outwrestling the elite wrestler and outstriking her 251-61 to win 49-46, 49-46, 49-45. Zhang successfully defended 14 of Suarez's 15 takedown attempts."
2026-07-29,Who did Cain Velasquez defeat by TKO in his second UFC fight at UFC Fight Night 14?,Jake O'Brien,Hard,Velasquez stopped O'Brien in the first round at UFC Fight Night 14 to improve to 2-0 in the UFC. He went on to KO Nogueira to earn a shot at Brock Lesnar and won the UFC heavyweight title at UFC 121.
2026-08-01,Who did Henry Cejudo defeat by split decision to win the UFC flyweight title at UFC 227?,Demetrious Johnson,Easy,Cejudo defeated Johnson in one of the closest title fights in flyweight history at UFC 227 ending Johnson's record-setting 11-defense reign to become the new champion.
2026-08-01,"What fighter went 31-1 (1 NC) to start his career, before losing to future UFC Heavyweight Champion Fabricio Werdum?",Fedor Emelianenko,Easy,"Fedor compiled a record of 31-1-1 NC before suffering a shock submission loss to Werdum at Strikeforce: Fedor vs. Werdum in June 2010. Werdum, who went on to win the UFC heavyweight title, caught the seemingly invincible Fedor in a triangle armbar."
2026-08-01,Who did Vicente Luque finish in the first round at UFC 260 in one of the most impressive performances of his career?,Tyron Woodley,Medium,Luque finished Woodley in round 1 at UFC 260 in March 2021 in one of the most dominant performances of his career. The finish was so complete it shot Luque into the upper echelon of the welterweight division.
2026-08-01,Who did Amanda Ribas submit by armbar in the first round at UFC 251 on Fight Island?,Paige VanZant,Medium,Ribas submitted VanZant with an armbar at UFC 251 on Fight Island to remain undefeated in the UFC and position herself as a strawweight contender. She later earned a title shot against Rose Namajunas.
2026-08-01,"What fighter had this four-fight winning streak: Unanimous Decision over Kevin Holland, TKO over Eryk Anders, KO over Jimi Manuwa, and TKO over Jan Blachowicz?",Thiago Santos,Hard,"Santos went on this run through the light heavyweight division to earn a UFC light heavyweight title shot against Jon Jones at UFC 239. Despite fighting with torn ligaments in both knees suffered during the fight, Santos came close to defeating Jones in one of the closest title fights in divisional history."
2026-08-03,Who did Francis Ngannou knock out in the second round to win the UFC heavyweight title at UFC 260?,Stipe Miocic,Easy,Ngannou finished Miocic with his devastating punching power in the second round at UFC 260 avenging his lopsided loss in their first fight and fulfilling his remarkable journey from poverty in Cameroon to world champion.
2026-08-03,Which fighter is nicknamed Bam Bam?,Tai Tuivasa,Easy,Tuivasa earned his nickname for his explosive knockout power and his love of celebrating wins by doing a shoey drinking from a shoe.
2026-08-03,"Who did Jon Jones stop by TKO in the first round at UFC 159, equalling Tito Ortiz's record for most consecutive light heavyweight title defenses?",Chael Sonnen,Medium,"Jones stopped Sonnen with ground-and-pound at 4:33 of round 1 at UFC 159 in April 2013, making his fifth consecutive title defense to equal Tito Ortiz's divisional record. The fight was Sonnen's first appearance at light heavyweight."
2026-08-03,"What former Bellator fighter is on a heater, winning seven consecutive fights, six by finish, with the last coming over David Onama at UFC Vegas 110?",Steve Garcia,Medium,"Garcia transferred his Bellator experience to the UFC and went on a remarkable finishing streak, going 7-0 with six stoppages including a finish of Onama at UFC Vegas 110. His aggressive finishing style made him one of the most exciting featherweights on the roster."
2026-08-03,Who did Chris Lytle defeat via submission in his retirement fight at UFC on Versus 5?,Dan Hardy,Hard,"Lytle submitted Hardy with a rear naked choke at UFC on Versus 5 in August 2011 in what he announced as his retirement fight. It was a fitting send-off for one of the UFC's most beloved fan favorites, known for his brawling style and always delivering exciting fights."
2026-08-05,Which kickboxing world champion came to the UFC and knocked out Israel Adesanya with the same punch that had stopped him twice in kickboxing?,Alex Pereira,Easy,Pereira had beaten Adesanya twice in kickboxing including a KO before they met in the UFC at UFC 281 where Pereira used the same left hook to win the middleweight title in the fifth round.
2026-08-05,Which fighter is nicknamed Durinho?,Gilbert Burns,Easy,Burns earned his nickname which means Little Hard One in Portuguese and has become one of the top welterweight contenders in the UFC.
2026-08-05,Who did Joanna Jedrzejczyk challenge for the UFC strawweight title at UFC 248?,Zhang Weili,Medium,Zhang and Jedrzejczyk put on a five-round war at UFC 248 that is widely regarded as the greatest women's MMA fight ever contested.
2026-08-05,Who did Ronaldo Souza defeat via KO at UFC 230?,Chris Weidman,Medium,Souza knocked out former UFC middleweight champion Weidman in round 1 at UFC 230 in November 2018 at Madison Square Garden. The finish was one of the most significant of Souza's UFC career and ended Weidman's hopes of a title run.
2026-08-05,"What fighter won five straight fights, with the fifth coming via TKO over Gray Maynard in a title eliminator, but never fought again due to a lingering concussion?",TJ Grant,Hard,"Grant finished Maynard in round 1 at UFC 160 in May 2013 to earn a lightweight title shot against Benson Henderson. However, he suffered a serious concussion and was never able to return to fighting, one of the great what-ifs in lightweight history."
2026-08-08,Who did Jamahal Hill defeat by unanimous decision to win the UFC light heavyweight title at UFC 283?,Glover Teixeira,Easy,"Hill defeated Teixeira by unanimous decision at UFC 283 in January 2023 in Rio de Janeiro to win the light heavyweight title. It was a back-and-forth fight that Hill won clearly on the scorecards, becoming the new champion."
2026-08-08,Who did Nate Diaz submit with a rear naked choke at UFC 196 in one of the biggest upsets in UFC history?,Conor McGregor,Easy,Diaz stepped in on short notice and submitted McGregor in the second round at UFC 196 in a result that shocked the entire MMA world and set up one of the sport's greatest rematches.
2026-08-08,Who did Jiri Prochazka submit in the final seconds to win the UFC light heavyweight title at UFC 275?,Glover Teixeira,Medium,Prochazka sunk in a rear naked choke with three seconds remaining at UFC 275 to submit Teixeira in one of the most dramatic finishes in light heavyweight championship history.
2026-08-08,"What Pride acquisition came into the UFC with five consecutive losses, and debuted with a loss to Sean McCorkle at UFC 119?",Mark Hunt,Medium,"Hunt arrived in the UFC after a rough stretch including five straight losses in Strikeforce and other promotions. He lost his UFC debut to McCorkle at UFC 119 in September 2010, but then went on one of the greatest turnarounds in UFC history, knocking out top heavyweights and becoming one of the most feared punchers in the division."
2026-08-08,Who did Jon Jones defeat by unanimous decision at UFC 172 to retain his UFC light heavyweight title?,Glover Teixeira,Hard,Jones defeated Teixeira by unanimous decision at UFC 172 in Washington DC in one of his most dominant performances landing over 200 significant strikes against the top contender.
2026-08-10,Who did Julianna Pena submit in the second round to win the UFC women's bantamweight title at UFC 269?,Amanda Nunes,Easy,Pena submitted the dominant champion Nunes with a rear naked choke in the second round at UFC 269 in one of the greatest upsets in women's MMA history.
2026-08-10,Who did Nate Diaz defeat by unanimous decision in his final fight before the McGregor rivalry?,Michael Johnson,Easy,"Diaz defeated Johnson by unanimous decision at UFC Fight Night 62 in January 2016. He called out McGregor after the fight and was given the opportunity when Rafael dos Anjos withdrew injured, leading to one of the biggest upsets in UFC history."
2026-08-10,Who did Mark Hunt shock with a unanimous decision at UFC Fight Night 135 in one of the most surprising heavyweight upsets?,Ben Rothwell,Medium,"Hunt defeated Rothwell by unanimous decision at UFC Fight Night 135 in Auckland in June 2018. Given Hunt's reputation as a knockout artist, the decision win was surprising, and the result itself was an upset given Rothwell's standing in the division."
2026-08-10,Who did Leon Edwards defeat by majority decision to make his second welterweight title defense at UFC 286?,Kamaru Usman,Medium,Edwards defeated Usman by majority decision in their trilogy fight at UFC 286 in Manchester to make his second title defense in front of his home crowd.
2026-08-10,Who is the only fighter to hold wins over Gray Maynard and Will Brooks?,Nik Lentz,Hard,"Lentz holds victories over both Maynard and Brooks during his lengthy UFC tenure as a consistent lightweight and featherweight competitor. Despite never getting a title shot, Lentz built a solid resume of wins over notable fighters throughout his career."
2026-08-12,Which fighter is nicknamed Chaos?,Colby Covington,Easy,Covington earned his Chaos nickname for his unpredictable personality and his aggressive wrestling-heavy style that earned him multiple welterweight title shots.
2026-08-12,Who did Petr Yan defeat to win the vacant UFC bantamweight championship at UFC 251?,Jose Aldo,Easy,Yan defeated Aldo by TKO in round 5 at UFC 251 in July 2020 on Fight Island to win the vacant bantamweight title. The title had been vacated when Henry Cejudo retired. Aldo had moved down from featherweight for the fight.
2026-08-12,Who did Kamaru Usman defeat by TKO in the fifth round to make his first UFC welterweight title defense at UFC 245?,Colby Covington,Medium,"Usman stopped Covington with punches in round 5 at UFC 245 in December 2019, making his first title defense. Covington had been dominant for much of the fight before Usman's heart and chin carried him to a late finish."
2026-08-12,What fighter defeated the rising and undefeated Stipe Miocic by TKO at UFC on Fuel TV 5?,Stefan Struve,Medium,Struve stopped an undefeated Miocic with a rear naked choke in round 1 at UFC on Fuel TV 5 in September 2012. It was the only time Miocic has been finished in his UFC career. Miocic regrouped and went on to become one of the greatest UFC heavyweight champions of all time.
2026-08-12,"What fighter had this four-fight winning streak: Submission over Francisco Rivera, Unanimous Decision over Rob Font, KO over Michael McDonald, and Split Decision over John Dodson?",John Lineker,Hard,"Lineker went on this impressive bantamweight run through the division, demonstrating his well-rounded skills with finishes and decision wins against quality opponents. Despite his impressive record, Lineker never captured a UFC title before moving on to other promotions."
